{
  "metadata": {
    "title": "Knowledge graph narativ autosuficient - Ion",
    "work": "Ion",
    "author": "Liviu Rebreanu",
    "language": "ro",
    "version": "2.0",
    "generated_at": "2026-08-05T09:22:46.491Z",
    "canonical_format": "JSON",
    "minimum_nodes": 300,
    "minimum_edges": 900,
    "packet_type": "chapter_subgraph",
    "chapter_id": "CH_01",
    "source_graph_sha256": "19e81d5c346fb9dbd11d025ee52a857284152d98a8c6421e5a3731ca8f82e1c3",
    "extraction_rule": "Toate nodurile asociate CH_01 și endpointurile nenarative ale muchiilor incidente; evenimentele din alte capitole sunt excluse."
  },
  "sources": [
    {
      "id": "SRC_PDF",
      "source_type": "primary_text",
      "title": "Ion - text integral",
      "author": "Liviu Rebreanu",
      "path": "C:/Users/raluc/.codex/worktrees/653f/BacApp2/data/sources/ion/ion.pdf",
      "confidence": 1
    },
    {
      "id": "SRC_SUMMARY",
      "source_type": "summary",
      "title": "Rezumat pe capitole - Ion",
      "path": "C:/Users/raluc/.codex/worktrees/653f/BacApp2/data/sources/ion/rezumat.md",
      "confidence": 0.97
    },
    {
      "id": "SRC_ESSAY",
      "source_type": "model_essay",
      "title": "Eseu-model - Ion",
      "path": "C:/Users/raluc/.codex/worktrees/653f/BacApp2/data/sources/ion/eseu_model.md",
      "confidence": 0.95
    },
    {
      "id": "SRC_PREVIOUS_GRAPH",
      "source_type": "previous_graph",
      "title": "Knowledge graph narativ Ion - 201 entități",
      "path": "C:/Users/raluc/.codex/visualizations/2026/07/30/019fb325-cf30-7611-a160-6f50462415f4/ion-complete-narrative-knowledge-graph.html",
      "confidence": 0.95
    },
    {
      "id": "REF_PDF_CH_01",
      "source_type": "primary_text",
      "title": "Ion - text integral",
      "chapter": "Capitolul I - Începutul",
      "pdf_page_start": 3,
      "pdf_page_end": 42,
      "evidence": "Intervalul asociat capitolului Capitolul I - Începutul.",
      "confidence": 0.98
    },
    {
      "id": "REF_SUM_CH_01",
      "source_type": "summary",
      "title": "Rezumat pe capitole - Ion",
      "chapter": "Capitolul I - Începutul",
      "evidence": "Secțiunea dedicată capitolului Capitolul I - Începutul.",
      "confidence": 0.97
    },
    {
      "id": "REF_PDF_CH_02",
      "source_type": "primary_text",
      "title": "Ion - text integral",
      "chapter": "Capitolul II - Zvârcolirea",
      "pdf_page_start": 43,
      "pdf_page_end": 80,
      "evidence": "Intervalul asociat capitolului Capitolul II - Zvârcolirea.",
      "confidence": 0.98
    },
    {
      "id": "REF_SUM_CH_02",
      "source_type": "summary",
      "title": "Rezumat pe capitole - Ion",
      "chapter": "Capitolul II - Zvârcolirea",
      "evidence": "Secțiunea dedicată capitolului Capitolul II - Zvârcolirea.",
      "confidence": 0.97
    },
    {
      "id": "REF_PDF_CH_03",
      "source_type": "primary_text",
      "title": "Ion - text integral",
      "chapter": "Capitolul III - Iubirea",
      "pdf_page_start": 81,
      "pdf_page_end": 122,
      "evidence": "Intervalul asociat capitolului Capitolul III - Iubirea.",
      "confidence": 0.98
    },
    {
      "id": "REF_SUM_CH_03",
      "source_type": "summary",
      "title": "Rezumat pe capitole - Ion",
      "chapter": "Capitolul III - Iubirea",
      "evidence": "Secțiunea dedicată capitolului Capitolul III - Iubirea.",
      "confidence": 0.97
    },
    {
      "id": "REF_PDF_CH_04",
      "source_type": "primary_text",
      "title": "Ion - text integral",
      "chapter": "Capitolul IV - Noaptea",
      "pdf_page_start": 123,
      "pdf_page_end": 181,
      "evidence": "Intervalul asociat capitolului Capitolul IV - Noaptea.",
      "confidence": 0.98
    },
    {
      "id": "REF_SUM_CH_04",
      "source_type": "summary",
      "title": "Rezumat pe capitole - Ion",
      "chapter": "Capitolul IV - Noaptea",
      "evidence": "Secțiunea dedicată capitolului Capitolul IV - Noaptea.",
      "confidence": 0.97
    },
    {
      "id": "REF_PDF_CH_05",
      "source_type": "primary_text",
      "title": "Ion - text integral",
      "chapter": "Capitolul V - Rușinea",
      "pdf_page_start": 182,
      "pdf_page_end": 223,
      "evidence": "Intervalul asociat capitolului Capitolul V - Rușinea.",
      "confidence": 0.98
    },
    {
      "id": "REF_SUM_CH_05",
      "source_type": "summary",
      "title": "Rezumat pe capitole - Ion",
      "chapter": "Capitolul V - Rușinea",
      "evidence": "Secțiunea dedicată capitolului Capitolul V - Rușinea.",
      "confidence": 0.97
    },
    {
      "id": "REF_PDF_CH_06",
      "source_type": "primary_text",
      "title": "Ion - text integral",
      "chapter": "Capitolul VI - Nunta",
      "pdf_page_start": 224,
      "pdf_page_end": 284,
      "evidence": "Intervalul asociat capitolului Capitolul VI - Nunta.",
      "confidence": 0.98
    },
    {
      "id": "REF_SUM_CH_06",
      "source_type": "summary",
      "title": "Rezumat pe capitole - Ion",
      "chapter": "Capitolul VI - Nunta",
      "evidence": "Secțiunea dedicată capitolului Capitolul VI - Nunta.",
      "confidence": 0.97
    },
    {
      "id": "REF_PDF_CH_07",
      "source_type": "primary_text",
      "title": "Ion - text integral",
      "chapter": "Capitolul VII - Vasile",
      "pdf_page_start": 285,
      "pdf_page_end": 322,
      "evidence": "Intervalul asociat capitolului Capitolul VII - Vasile.",
      "confidence": 0.98
    },
    {
      "id": "REF_SUM_CH_07",
      "source_type": "summary",
      "title": "Rezumat pe capitole - Ion",
      "chapter": "Capitolul VII - Vasile",
      "evidence": "Secțiunea dedicată capitolului Capitolul VII - Vasile.",
      "confidence": 0.97
    },
    {
      "id": "REF_PDF_CH_08",
      "source_type": "primary_text",
      "title": "Ion - text integral",
      "chapter": "Capitolul VIII - Copilul",
      "pdf_page_start": 323,
      "pdf_page_end": 364,
      "evidence": "Intervalul asociat capitolului Capitolul VIII - Copilul.",
      "confidence": 0.98
    },
    {
      "id": "REF_SUM_CH_08",
      "source_type": "summary",
      "title": "Rezumat pe capitole - Ion",
      "chapter": "Capitolul VIII - Copilul",
      "evidence": "Secțiunea dedicată capitolului Capitolul VIII - Copilul.",
      "confidence": 0.97
    },
    {
      "id": "REF_PDF_CH_09",
      "source_type": "primary_text",
      "title": "Ion - text integral",
      "chapter": "Capitolul IX - Sărutarea",
      "pdf_page_start": 365,
      "pdf_page_end": 408,
      "evidence": "Intervalul asociat capitolului Capitolul IX - Sărutarea.",
      "confidence": 0.98
    },
    {
      "id": "REF_SUM_CH_09",
      "source_type": "summary",
      "title": "Rezumat pe capitole - Ion",
      "chapter": "Capitolul IX - Sărutarea",
      "evidence": "Secțiunea dedicată capitolului Capitolul IX - Sărutarea.",
      "confidence": 0.97
    },
    {
      "id": "REF_PDF_CH_10",
      "source_type": "primary_text",
      "title": "Ion - text integral",
      "chapter": "Capitolul X - Ștreangul",
      "pdf_page_start": 409,
      "pdf_page_end": 431,
      "evidence": "Intervalul asociat capitolului Capitolul X - Ștreangul.",
      "confidence": 0.98
    },
    {
      "id": "REF_SUM_CH_10",
      "source_type": "summary",
      "title": "Rezumat pe capitole - Ion",
      "chapter": "Capitolul X - Ștreangul",
      "evidence": "Secțiunea dedicată capitolului Capitolul X - Ștreangul.",
      "confidence": 0.97
    },
    {
      "id": "REF_PDF_CH_11",
      "source_type": "primary_text",
      "title": "Ion - text integral",
      "chapter": "Capitolul XI - Blestemul",
      "pdf_page_start": 432,
      "pdf_page_end": 478,
      "evidence": "Intervalul asociat capitolului Capitolul XI - Blestemul.",
      "confidence": 0.98
    },
    {
      "id": "REF_SUM_CH_11",
      "source_type": "summary",
      "title": "Rezumat pe capitole - Ion",
      "chapter": "Capitolul XI - Blestemul",
      "evidence": "Secțiunea dedicată capitolului Capitolul XI - Blestemul.",
      "confidence": 0.97
    },
    {
      "id": "REF_PDF_CH_12",
      "source_type": "primary_text",
      "title": "Ion - text integral",
      "chapter": "Capitolul XII - George",
      "pdf_page_start": 479,
      "pdf_page_end": 515,
      "evidence": "Intervalul asociat capitolului Capitolul XII - George.",
      "confidence": 0.98
    },
    {
      "id": "REF_SUM_CH_12",
      "source_type": "summary",
      "title": "Rezumat pe capitole - Ion",
      "chapter": "Capitolul XII - George",
      "evidence": "Secțiunea dedicată capitolului Capitolul XII - George.",
      "confidence": 0.97
    },
    {
      "id": "REF_PDF_CH_13",
      "source_type": "primary_text",
      "title": "Ion - text integral",
      "chapter": "Capitolul XIII - Sfârșitul",
      "pdf_page_start": 516,
      "pdf_page_end": 547,
      "evidence": "Intervalul asociat capitolului Capitolul XIII - Sfârșitul.",
      "confidence": 0.98
    },
    {
      "id": "REF_SUM_CH_13",
      "source_type": "summary",
      "title": "Rezumat pe capitole - Ion",
      "chapter": "Capitolul XIII - Sfârșitul",
      "evidence": "Secțiunea dedicată capitolului Capitolul XIII - Sfârșitul.",
      "confidence": 0.97
    }
  ],
  "ontology": {
    "node_types": [
      "Work",
      "Author",
      "Part",
      "Chapter",
      "NarrativeEvent",
      "NarrativeSubevent",
      "Character",
      "CharacterState",
      "NarrativeState",
      "Decision",
      "Motivation",
      "Action",
      "Consequence",
      "Location",
      "TimeContext",
      "Object",
      "Family",
      "Institution",
      "SocialGroup",
      "Relationship",
      "Conflict",
      "Theme",
      "Motif",
      "Symbol",
      "Value",
      "Emotion",
      "SocialStatus",
      "NarrativePerspective",
      "LiteraryTechnique",
      "Evidence",
      "SourceFragment",
      "SourceDocument",
      "OntologyClass"
    ],
    "relationship_types": [
      "instance_of",